{
  "issuer": {
    "id": "https://jargon.sh",
    "street": "The quick brown fox jumps over the lazy dog.",
    "city": "The quick brown fox jumps over the lazy dog.",
    "state": "The quick brown fox jumps over the lazy dog.",
    "zip": 12345,
    "country": "The quick brown fox jumps over the lazy dog."
  },
  "issuanceDate": "1970-01-01T00:00:00Z",
  "id": "https://jargon.sh",
  "credentialSubject": {
    "id": "https://jargon.sh",
    "billOfLadingNumber": "The quick brown fox jumps over the lazy dog.",
    "bookingNumber[]": "The quick brown fox jumps over the lazy dog.",
    "issueDate": "1970-01-01",
    "actualArrivalDate": "1970-01-01",
    "estimatedTimeOfDeparture": "1970-01-01",
    "actualDepartureDate": "1970-01-01",
    "consignmentLoadingDate": "1970-01-01",
    "estimatedTimeOfArrival": "1970-01-01",
    "buyer": {
      "id": "https://jargon.sh",
      "street": "The quick brown fox jumps over the lazy dog.",
      "city": "The quick brown fox jumps over the lazy dog.",
      "state": "The quick brown fox jumps over the lazy dog.",
      "zip": 12345,
      "country": "The quick brown fox jumps over the lazy dog."
    },
    "Importer": {
      "id": "https://jargon.sh",
      "street": "The quick brown fox jumps over the lazy dog.",
      "city": "The quick brown fox jumps over the lazy dog.",
      "state": "The quick brown fox jumps over the lazy dog.",
      "zip": 12345,
      "country": "The quick brown fox jumps over the lazy dog."
    },
    "exporter": {
      "id": "https://jargon.sh",
      "street": "The quick brown fox jumps over the lazy dog.",
      "city": "The quick brown fox jumps over the lazy dog.",
      "state": "The quick brown fox jumps over the lazy dog.",
      "zip": 12345,
      "country": "The quick brown fox jumps over the lazy dog."
    },
    "carrier": {
      "id": "https://jargon.sh",
      "street": "The quick brown fox jumps over the lazy dog.",
      "city": "The quick brown fox jumps over the lazy dog.",
      "state": "The quick brown fox jumps over the lazy dog.",
      "zip": 12345,
      "country": "The quick brown fox jumps over the lazy dog."
    },
    "consignee": {
      "id": "https://jargon.sh",
      "street": "The quick brown fox jumps over the lazy dog.",
      "city": "The quick brown fox jumps over the lazy dog.",
      "state": "The quick brown fox jumps over the lazy dog.",
      "zip": 12345,
      "country": "The quick brown fox jumps over the lazy dog."
    },
    "freightForwarder": {
      "id": "https://jargon.sh",
      "street": "The quick brown fox jumps over the lazy dog.",
      "city": "The quick brown fox jumps over the lazy dog.",
      "state": "The quick brown fox jumps over the lazy dog.",
      "zip": 12345,
      "country": "The quick brown fox jumps over the lazy dog."
    },
    "notifyParty[]": {
      "id": "https://jargon.sh",
      "street": "The quick brown fox jumps over the lazy dog.",
      "city": "The quick brown fox jumps over the lazy dog.",
      "state": "The quick brown fox jumps over the lazy dog.",
      "zip": 12345,
      "country": "The quick brown fox jumps over the lazy dog."
    },
    "despatchParty": {
      "id": "https://jargon.sh",
      "street": "The quick brown fox jumps over the lazy dog.",
      "city": "The quick brown fox jumps over the lazy dog.",
      "state": "The quick brown fox jumps over the lazy dog.",
      "zip": 12345,
      "country": "The quick brown fox jumps over the lazy dog."
    },
    "consignor": {
      "id": "https://jargon.sh",
      "street": "The quick brown fox jumps over the lazy dog.",
      "city": "The quick brown fox jumps over the lazy dog.",
      "state": "The quick brown fox jumps over the lazy dog.",
      "zip": 12345,
      "country": "The quick brown fox jumps over the lazy dog."
    },
    "freightPayer": {
      "id": "https://jargon.sh",
      "street": "The quick brown fox jumps over the lazy dog.",
      "city": "The quick brown fox jumps over the lazy dog.",
      "state": "The quick brown fox jumps over the lazy dog.",
      "zip": 12345,
      "country": "The quick brown fox jumps over the lazy dog."
    },
    "shippingDate": "1970-01-01",
    "particulars": {
      "descriptionOfGoods": "The quick brown fox jumps over the lazy dog.",
      "numberOfPackages": 12345,
      "commodityCode": "The quick brown fox jumps over the lazy dog."
    },
    "equipment[]": {
      "id": "https://jargon.sh",
      "type": "The quick brown fox jumps over the lazy dog."
    }
  }
}